<patient
        xmlns:pat="http://www.bharatthippireddy.com/Patient"
        xmlns:xsi="http://www.w3.org/2001/XMLSchema-instance"
        xsi:schemaLocation="http://www.bharatthippireddy.com/Patient patient.xsd">
    <id>3</id>
    <firstName>diab</firstName>
    <lastName>abdelhalim</lastName>
    <age>3</age>
    <birthDate>2008-09-29</birthDate>
    <email>string</email>
    <address>Sayeh ABDALLAH STREET</address>
    <gender>Male</gender>
    <phone>string</phone>
    <payment>
        <insurance>
            <provider>Axa</provider>
            <limit>1000</limit>
        </insurance>
    </payment>
</patient>