<patient
        xmlns:tns="http://www.bharatthippireddy.com/Patient"
        xmlns:xsi="http://www.w3.org/2001/XMLSchema-instance"
        xsi:schemaLocation="http://www.bharatthippireddy.com/Patient patient.xsd" id="123">
    <tns:id>3</tns:id>
    <tns:firstName>diab</tns:firstName>
    <tns:lastName>abdelhalim</tns:lastName>
    <tns:age>3</tns:age>
    <tns:birthDate>2008-09-29</tns:birthDate>
    <tns:email>string</tns:email>
    <tns:address>Sayeh ABDALLAH STREET</tns:address>
    <tns:gender>Male</tns:gender>
    <tns:phone>string</tns:phone>
    <tns:payment>
        <tns:insurance>
            <tns:provider>Axa</tns:provider>
            <tns:limit>1000</tns:limit>
        </tns:insurance>
    </tns:payment>
</patient>